{
  "evidenceVersion": "0.2.0",
  "seedPolicyVersion": "cad-scene-seed-policy-v0.2",
  "sceneSpecVersion": "0.5.0",
  "sourceHash": "sha256:6de69c56aac4cdc9e98f1a658c62974e4af8e53aff9f19382d352b7143fcab9e",
  "cadDocumentHash": "sha256:7cdd0a8b9d47a74bc57edec6449594d59c4c46682b568c141475f9e84a3aaf29",
  "profileHash": "sha256:120a33f5919cbc03a0c0f7db42f0770cca9645d8bfd4348d8012f269d5b63f39",
  "candidateBasis": "space_wall_stage",
  "architecturalExtractionHash": null,
  "spaceWallStageHash": "sha256:ab13a1ac0eed9d9deec986e78bb14bbe6b04aa7119467488184a76ac3083a81a",
  "architecturalTopologyHash": "sha256:d8be5d08652116e14a7f959adf3efcd80148c7615661d2a7448fce68f74c2f59",
  "partitionPolicyVersion": "cad-shared-partition-policy-v0.1",
  "partitionApprovalId": "approval_partitions_two_room",
  "partitionApprovalHash": "sha256:bcb1a14c24df3d512a2fa258f398a6cd8218d2960435cdc1a571b3351eb1f563",
  "reviewedPartitionModelHash": "sha256:3f57213e3260437b21cc354efd1d6ed3c79bae9597ca92fe2fce59a41d8be017",
  "sceneApprovalId": "approval_cad_multispace_seed_001",
  "sceneApprovalHash": "sha256:794f86595cf02585afc1ab6e7cbcf50697185e26a9d1c6872c4f6d7db8c53abb",
  "sceneSpecHash": "sha256:341f67b720881d6236d8b2dca63c31671c8c64fef48f9ef299c7bc7ff851d779",
  "projectId": "project_cad_multispace_001",
  "sceneId": "scene_cad_multispace_001",
  "revisionId": "rev_cad_multispace_0001",
  "mappingSummary": {
    "levelCount": 1,
    "spaceCount": 2,
    "wallCount": 6,
    "sharedPartitionCount": 1,
    "surfaceCount": 4,
    "openingCount": 1,
    "partitionDoorCount": 1
  },
  "spatialPolicyVersion": "spatial-policy-v0.2",
  "spatialValidationStatus": "PASS",
  "circulationPolicyVersion": "circulation-policy-v0.2",
  "circulationRequirementStatus": "PASS",
  "status": "PASS"
}
